[
  {
    "id": "comment-001",
    "author": "Alice Chen",
    "content": "This capacitor value seems low for the expected ripple current. Consider upgrading to 220uF.",
    "createdAt": "2026-01-22T14:30:00Z",
    "componentRef": "C1",
    "status": "open"
  },
  {
    "id": "comment-002",
    "author": "Bob Smith",
    "content": "Good catch on the LED resistor - the math checks out for 20mA.",
    "createdAt": "2026-01-22T15:45:00Z",
    "componentRef": "R1",
    "status": "resolved"
  },
  {
    "id": "comment-003",
    "author": "Alice Chen",
    "content": "Overall the power section looks solid. Nice work!",
    "createdAt": "2026-01-23T09:00:00Z",
    "status": "open"
  },
  {
    "id": "comment-004",
    "author": "Carol Davis",
    "content": "Should we add decoupling caps near U1? The datasheet recommends 100nF.",
    "createdAt": "2026-01-23T10:15:00Z",
    "componentRef": "U1",
    "status": "open"
  }
]
